{
  "contract_version": 10,
  "suite": "home_catalogs",
  "case_id": "no_hero_list_yields_empty_hero_result",
  "input": {
    "snapshot": {
      "profile_id": "p1",
      "status_message": "",
      "lists": [
        {
          "kind": "featured",
          "variant_key": "default",
          "source": "personal",
          "presentation": "rail",
          "name": "featured",
          "heading": "Staff picks",
          "title": "Featured",
          "subtitle": "",
          "media_types": [
            "series"
          ],
          "items": [
            {
              "item_id": "show:tmdb:95396",
              "title": "Severance",
              "artwork_url": "https://img/severance.jpg",
              "addon_id": "supabase",
              "type": "series",
              "rating": null,
              "year": "2022",
              "description": null
            },
            {
              "item_id": "show:tmdb:125988",
              "title": "Silo",
              "artwork_url": "https://img/silo.jpg",
              "addon_id": "supabase",
              "type": "series",
              "rating": null,
              "year": "2023",
              "description": null
            }
          ]
        },
        {
          "kind": "movies",
          "variant_key": "default",
          "source": "personal",
          "presentation": "rail",
          "name": "movies",
          "heading": "",
          "title": "Movies",
          "subtitle": "",
          "media_types": [
            "movie"
          ],
          "items": [
            {
              "item_id": "movie:tmdb:157336",
              "title": "Arrival",
              "artwork_url": "https://img/arrival.jpg",
              "addon_id": "supabase",
              "type": "movie",
              "rating": "8.0",
              "year": "2016",
              "description": "First contact"
            }
          ]
        }
      ]
    },
    "section_limit": 0,
    "page": {
      "catalog_id": "personal:featured:default",
      "page": 0,
      "page_size": 0
    }
  },
  "expected": {
    "personal_feed": {
      "hero_result": {
        "items": [],
        "status_message": "No featured items available."
      },
      "sections": [
        {
          "kind": "featured",
          "catalog_id": "personal:featured:default",
          "source": "personal",
          "presentation": "rail",
          "variant_key": "default",
          "name": "featured",
          "heading": "Staff picks",
          "title": "Featured",
          "subtitle": ""
        }
      ],
      "sections_status_message": ""
    },
    "page": {
      "items": [
        {
          "item_id": "show:tmdb:95396",
          "title": "Severance",
          "artwork_url": "https://img/severance.jpg",
          "addon_id": "supabase",
          "type": "series",
          "rating": null,
          "year": "2022",
          "description": null
        }
      ],
      "status_message": "",
      "attempted_urls": [
        "supabase:personal:p1:featured:default:page=1"
      ]
    }
  }
}
