{
  "contract_version": 10,
  "suite": "home_catalogs",
  "case_id": "plans_hero_sections_and_global_page",
  "input": {
    "snapshot": {
      "profile_id": "profile-123",
      "status_message": "",
      "lists": [
        {
          "kind": "hero_similar",
          "variant_key": "default",
          "source": "personal",
          "presentation": "hero",
          "name": "hero_similar",
          "heading": "",
          "title": "Hero Shelf",
          "subtitle": "Because you watched sci-fi",
          "media_types": [
            "movie"
          ],
          "items": [
            {
              "item_id": "movie:tmdb:157336",
              "title": "Arrival",
              "artwork_url": "https://img/arrival-backdrop.jpg",
              "addon_id": "supabase",
              "type": "movie",
              "rating": "8.0",
              "year": "2016",
              "description": null
            },
            {
              "item_id": "movie:tmdb:438631",
              "title": "Dune",
              "artwork_url": "https://img/dune-poster.jpg",
              "addon_id": "supabase",
              "type": "movie",
              "rating": "8.2",
              "year": "2021",
              "description": "Sand and prophecy"
            },
            {
              "item_id": "movie:tmdb:999003",
              "title": "No Art",
              "artwork_url": null,
              "addon_id": "supabase",
              "type": "movie",
              "rating": null,
              "year": null,
              "description": null
            }
          ]
        },
        {
          "kind": "trending-series",
          "variant_key": "default",
          "source": "personal",
          "presentation": "rail",
          "name": "trending-series",
          "heading": "",
          "title": "Trending Series",
          "subtitle": "Binge now",
          "media_types": [
            "series"
          ],
          "items": [
            {
              "item_id": "show:tmdb:95396",
              "title": "Severance",
              "artwork_url": "https://img/severance-backdrop.jpg",
              "addon_id": "supabase",
              "type": "series",
              "rating": "8.7",
              "year": "2022",
              "description": "Work-life split"
            },
            {
              "item_id": "show:tmdb:125988",
              "title": "Silo",
              "artwork_url": "https://img/silo-backdrop.jpg",
              "addon_id": "supabase",
              "type": "series",
              "rating": "8.1",
              "year": "2023",
              "description": "Underground mystery"
            }
          ]
        },
        {
          "kind": "popular-movies",
          "variant_key": "default",
          "source": "personal",
          "presentation": "rail",
          "name": "popular-movies",
          "heading": "",
          "title": "Popular Movies",
          "subtitle": "Blockbusters",
          "media_types": [
            "movie"
          ],
          "items": [
            {
              "item_id": "movie:tmdb:786892",
              "title": "Furiosa",
              "artwork_url": "https://img/furiosa-backdrop.jpg",
              "addon_id": "supabase",
              "type": "movie",
              "rating": "7.7",
              "year": "2024",
              "description": "Wasteland origin"
            }
          ]
        }
      ]
    },
    "section_limit": 2,
    "page": {
      "catalog_id": "personal:trending-series:default",
      "page": 2,
      "page_size": 1
    }
  },
  "expected": {
    "personal_feed": {
      "hero_result": {
        "items": [
          {
            "item_id": "movie:tmdb:157336",
            "title": "Arrival",
            "description": "Because you watched sci-fi",
            "rating": "8.0",
            "year": "2016",
            "genres": [],
            "artwork_url": "https://img/arrival-backdrop.jpg",
            "addon_id": "supabase",
            "type": "movie"
          },
          {
            "item_id": "movie:tmdb:438631",
            "title": "Dune",
            "description": "Sand and prophecy",
            "rating": "8.2",
            "year": "2021",
            "genres": [],
            "artwork_url": "https://img/dune-poster.jpg",
            "addon_id": "supabase",
            "type": "movie"
          }
        ],
        "status_message": ""
      },
      "sections": [
        {
          "kind": "trending-series",
          "catalog_id": "personal:trending-series:default",
          "source": "personal",
          "presentation": "rail",
          "variant_key": "default",
          "name": "trending-series",
          "heading": "",
          "title": "Trending Series",
          "subtitle": "Binge now"
        },
        {
          "kind": "popular-movies",
          "catalog_id": "personal:popular-movies:default",
          "source": "personal",
          "presentation": "rail",
          "variant_key": "default",
          "name": "popular-movies",
          "heading": "",
          "title": "Popular Movies",
          "subtitle": "Blockbusters"
        }
      ],
      "sections_status_message": ""
    },
    "page": {
      "items": [
        {
          "item_id": "show:tmdb:125988",
          "title": "Silo",
          "artwork_url": "https://img/silo-backdrop.jpg",
          "addon_id": "supabase",
          "type": "series",
          "rating": "8.1",
          "year": "2023",
          "description": "Underground mystery"
        }
      ],
      "status_message": "",
      "attempted_urls": [
        "supabase:personal:profile-123:trending-series:default:page=2"
      ]
    }
  }
}
