{
  "contract_version": 10,
  "suite": "home_catalogs",
  "case_id": "empty_snapshot_propagates_status",
  "input": {
    "snapshot": {
      "profile_id": null,
      "status_message": "Sign in to Supabase to load catalogs.",
      "lists": []
    },
    "section_limit": 10,
    "page": {
      "catalog_id": "personal:anything:default",
      "page": 1,
      "page_size": 10
    }
  },
  "expected": {
    "personal_feed": {
      "hero_result": {
        "items": [],
        "status_message": "Sign in to Supabase to load catalogs."
      },
      "sections": [],
      "sections_status_message": "Sign in to Supabase to load catalogs."
    },
    "page": {
      "items": [],
      "status_message": "Sign in to Supabase to load catalogs.",
      "attempted_urls": []
    }
  }
}
