{
  "contract_version": 10,
  "suite": "home_catalogs",
  "case_id": "reports_missing_artwork_and_missing_catalog",
  "input": {
    "snapshot": {
      "profile_id": "p2",
      "status_message": "",
      "lists": [
        {
          "kind": "hero-recommendations",
          "variant_key": "default",
          "source": "personal",
          "presentation": "hero",
          "name": "hero-recommendations",
          "heading": "",
          "title": "Featured",
          "subtitle": "",
          "media_types": [
            "movie"
          ],
          "items": [
            {
              "item_id": "movie:tmdb:991001",
              "title": "Invisible",
              "artwork_url": null,
              "addon_id": "supabase",
              "type": "movie",
              "rating": null,
              "year": null,
              "description": null
            }
          ]
        },
        {
          "kind": "drama",
          "variant_key": "default",
          "source": "personal",
          "presentation": "rail",
          "name": "drama",
          "heading": "",
          "title": "Drama",
          "subtitle": "Tense stories",
          "media_types": [
            "series"
          ],
          "items": [
            {
              "item_id": "show:tmdb:157239",
              "title": "Dark Matter",
              "artwork_url": "https://img/dark-matter-backdrop.jpg",
              "addon_id": "supabase",
              "type": "series",
              "rating": "7.5",
              "year": "2024",
              "description": "Parallel lives"
            }
          ]
        }
      ]
    },
    "section_limit": 5,
    "page": {
      "catalog_id": "personal:unknown:default",
      "page": 1,
      "page_size": 5
    }
  },
  "expected": {
    "personal_feed": {
      "hero_result": {
        "items": [],
        "status_message": "No featured items available."
      },
      "sections": [
        {
          "kind": "drama",
          "catalog_id": "personal:drama:default",
          "source": "personal",
          "presentation": "rail",
          "variant_key": "default",
          "name": "drama",
          "heading": "",
          "title": "Drama",
          "subtitle": "Tense stories"
        }
      ],
      "sections_status_message": ""
    },
    "page": {
      "items": [],
      "status_message": "Catalog not found.",
      "attempted_urls": []
    }
  }
}
